{
  "schema": "model.v1",
  "id": "example.humanoid.tall",
  "type": "humanoid",
  "rig": "humanoid.v1",
  "parameters": {
    "height": 2.2,
    "bodyWidth": 0.65,
    "armThickness": 0.23
  },
  "sockets": [
    {
      "id": "grip",
      "parent": "Arm_R",
      "position": [
        -0.65,
        0,
        0
      ]
    }
  ]
}
