{
  "schema": "model.v1",
  "id": "FSA_ENEMY_B001_Pursuer",
  "type": "humanoid",
  "rig": "humanoid.v1",
  "parameters": { "height": 1.8 },
  "materials": {
    "skin": { "color": "#9A9985", "roughness": 0.95 },
    "coat": { "color": "#484A42", "roughness": 0.94 },
    "armor": { "color": "#343A37", "roughness": 0.81, "metalness": 0.14 },
    "under": { "color": "#252B2A", "roughness": 0.96 },
    "wrap": { "color": "#676858", "roughness": 0.93 },
    "accent": { "color": "#B76A36", "roughness": 0.75 },
    "bone": { "color": "#C6BEA1", "roughness": 0.83 },
    "eye": { "color": "#E3A45E", "emissive": "#553014", "roughness": 0.5 },
    "boot": { "color": "#30312C", "roughness": 0.89 }
  },
  "parts": [
    { "id": "Pelvis", "parent": "Body", "shape": { "type": "box", "size": [0.31, 0.18, 0.23] }, "position": [0, 0.07, 0], "material": "under" },
    { "id": "Waist", "parent": "Body", "shape": { "type": "box", "size": [0.27, 0.22, 0.20] }, "position": [0, 0.23, 0.015], "material": "coat" },
    { "id": "Chest", "parent": "Body", "shape": { "type": "box", "size": [0.37, 0.37, 0.25] }, "position": [0, 0.43, 0.055], "rotation": [20, 0, 0], "material": "coat" },
    { "id": "ShoulderYoke", "parent": "Body", "shape": { "type": "box", "size": [0.51, 0.105, 0.28] }, "position": [0, 0.585, 0.075], "rotation": [20, 0, 0], "material": "armor" },
    { "id": "RidgeL", "parent": "Body", "shape": { "type": "cone", "radius": 0.085, "height": 0.24 }, "position": [0.20, 0.65, -0.065], "rotation": [-18, 0, -35], "material": "armor" },
    { "id": "RidgeR", "parent": "Body", "shape": { "type": "cone", "radius": 0.085, "height": 0.24 }, "position": [-0.20, 0.65, -0.065], "rotation": [-18, 0, 35], "material": "armor" },
    { "id": "SpinePlate", "parent": "Body", "shape": { "type": "box", "size": [0.12, 0.41, 0.07] }, "position": [0, 0.39, -0.16], "rotation": [20, 0, 0], "material": "armor" },
    { "id": "ChestStripeL", "parent": "Body", "shape": { "type": "box", "size": [0.063, 0.27, 0.022] }, "position": [0.10, 0.45, 0.19], "rotation": [20, 0, -20], "material": "accent" },
    { "id": "ChestStripeR", "parent": "Body", "shape": { "type": "box", "size": [0.063, 0.27, 0.022] }, "position": [-0.10, 0.45, 0.19], "rotation": [20, 0, 20], "material": "accent" },
    { "id": "Belt", "parent": "Body", "shape": { "type": "box", "size": [0.326, 0.065, 0.245] }, "position": [0, 0.14, 0], "material": "armor" },
    { "id": "BeltTab", "parent": "Body", "shape": { "type": "box", "size": [0.065, 0.07, 0.026] }, "position": [0, 0.14, 0.136], "material": "accent" },
    { "id": "CoatTailL", "parent": "Body", "shape": { "type": "box", "size": [0.115, 0.32, 0.065] }, "position": [0.115, -0.025, -0.135], "rotation": [-20, 0, 12], "material": "coat" },
    { "id": "CoatTailR", "parent": "Body", "shape": { "type": "box", "size": [0.115, 0.32, 0.065] }, "position": [-0.115, -0.025, -0.135], "rotation": [-20, 0, -12], "material": "coat" },
    { "id": "Neck", "parent": "Head", "shape": { "type": "cylinder", "radiusTop": 0.075, "radiusBottom": 0.09, "height": 0.14 }, "position": [0, -0.025, 0.075], "material": "skin" },
    { "id": "Skull", "parent": "Head", "shape": { "type": "box", "size": [0.225, 0.22, 0.22] }, "position": [0, 0.145, 0.13], "rotation": [18, 0, 0], "material": "skin" },
    { "id": "BrowPlate", "parent": "Head", "shape": { "type": "box", "size": [0.265, 0.058, 0.26] }, "position": [0, 0.235, 0.11], "rotation": [18, 0, 0], "material": "armor" },
    { "id": "FaceMask", "parent": "Head", "shape": { "type": "box", "size": [0.20, 0.095, 0.042] }, "position": [0, 0.055, 0.245], "rotation": [18, 0, 0], "material": "under" },
    { "id": "JawGuard", "parent": "Head", "shape": { "type": "box", "size": [0.15, 0.035, 0.065] }, "position": [0, 0.005, 0.246], "material": "bone" },
    { "id": "EyeL", "parent": "Head", "shape": { "type": "box", "size": [0.058, 0.025, 0.015] }, "position": [0.058, 0.155, 0.257], "rotation": [0, 0, 14], "material": "eye" },
    { "id": "EyeR", "parent": "Head", "shape": { "type": "box", "size": [0.058, 0.025, 0.015] }, "position": [-0.058, 0.155, 0.257], "rotation": [0, 0, -14], "material": "eye" },
    { "id": "Crest", "parent": "Head", "shape": { "type": "box", "size": [0.085, 0.075, 0.29] }, "position": [0, 0.277, 0.015], "rotation": [-24, 0, 0], "material": "armor" },
    { "id": "UpperArmL", "parent": "Arm_L", "shape": { "type": "box", "size": [0.34, 0.17, 0.19] }, "position": [0.175, 0.015, 0.005], "material": "coat" },
    { "id": "ShoulderPadL", "parent": "Arm_L", "shape": { "type": "box", "size": [0.20, 0.20, 0.24] }, "position": [0.07, 0.055, 0.025], "rotation": [0, 0, -22], "material": "armor" },
    { "id": "ElbowL", "parent": "Arm_L", "shape": { "type": "sphere", "radius": 0.084 }, "position": [0.35, 0.015, 0.008], "material": "skin" },
    { "id": "ForearmL", "parent": "Arm_L", "shape": { "type": "box", "size": [0.275, 0.115, 0.14] }, "position": [0.475, 0.015, 0.03], "material": "skin" },
    { "id": "ForearmGuardL", "parent": "Arm_L", "shape": { "type": "box", "size": [0.205, 0.04, 0.145] }, "position": [0.475, 0.09, 0.03], "material": "wrap" },
    { "id": "WristL", "parent": "Arm_L", "shape": { "type": "box", "size": [0.06, 0.14, 0.16] }, "position": [0.58, 0.015, 0.03], "material": "accent" },
    { "id": "PalmL", "parent": "Arm_L", "shape": { "type": "box", "size": [0.13, 0.115, 0.13] }, "position": [0.64, 0.015, 0.03], "material": "skin" },
    { "id": "ClawL", "parent": "Arm_L", "shape": { "type": "cone", "radius": 0.043, "height": 0.20 }, "position": [0.755, 0.015, 0.03], "rotation": [0, 0, -90], "material": "bone" },
    { "id": "UpperArmR", "parent": "Arm_R", "shape": { "type": "box", "size": [0.34, 0.17, 0.19] }, "position": [-0.175, 0.015, 0.005], "material": "coat" },
    { "id": "ShoulderPadR", "parent": "Arm_R", "shape": { "type": "box", "size": [0.20, 0.20, 0.24] }, "position": [-0.07, 0.055, 0.025], "rotation": [0, 0, 22], "material": "armor" },
    { "id": "ElbowR", "parent": "Arm_R", "shape": { "type": "sphere", "radius": 0.084 }, "position": [-0.35, 0.015, 0.008], "material": "skin" },
    { "id": "ForearmR", "parent": "Arm_R", "shape": { "type": "box", "size": [0.275, 0.115, 0.14] }, "position": [-0.475, 0.015, 0.03], "material": "skin" },
    { "id": "ForearmGuardR", "parent": "Arm_R", "shape": { "type": "box", "size": [0.205, 0.04, 0.145] }, "position": [-0.475, 0.09, 0.03], "material": "wrap" },
    { "id": "WristR", "parent": "Arm_R", "shape": { "type": "box", "size": [0.06, 0.14, 0.16] }, "position": [-0.58, 0.015, 0.03], "material": "accent" },
    { "id": "PalmR", "parent": "Arm_R", "shape": { "type": "box", "size": [0.13, 0.115, 0.13] }, "position": [-0.64, 0.015, 0.03], "material": "skin" },
    { "id": "ClawR", "parent": "Arm_R", "shape": { "type": "cone", "radius": 0.043, "height": 0.20 }, "position": [-0.755, 0.015, 0.03], "rotation": [0, 0, 90], "material": "bone" },
    { "id": "ThighL", "parent": "Leg_L", "shape": { "type": "box", "size": [0.195, 0.38, 0.20] }, "position": [0, -0.19, 0.005], "material": "coat" },
    { "id": "KneeL", "parent": "Leg_L", "shape": { "type": "box", "size": [0.19, 0.13, 0.22] }, "position": [0, -0.43, 0.035], "material": "armor" },
    { "id": "ShinL", "parent": "Leg_L", "shape": { "type": "box", "size": [0.145, 0.34, 0.165] }, "position": [0, -0.62, 0.015], "material": "wrap" },
    { "id": "ShinMarkL", "parent": "Leg_L", "shape": { "type": "box", "size": [0.08, 0.19, 0.02] }, "position": [0, -0.62, 0.105], "material": "accent" },
    { "id": "BootL", "parent": "Leg_L", "shape": { "type": "box", "size": [0.175, 0.14, 0.26] }, "position": [0, -0.735, 0.065], "material": "boot" },
    { "id": "SoleL", "parent": "Leg_L", "shape": { "type": "box", "size": [0.18, 0.045, 0.27] }, "position": [0, -0.804, 0.067], "material": "under" },
    { "id": "ThighR", "parent": "Leg_R", "shape": { "type": "box", "size": [0.195, 0.38, 0.20] }, "position": [0, -0.19, 0.005], "material": "coat" },
    { "id": "KneeR", "parent": "Leg_R", "shape": { "type": "box", "size": [0.19, 0.13, 0.22] }, "position": [0, -0.43, 0.035], "material": "armor" },
    { "id": "ShinR", "parent": "Leg_R", "shape": { "type": "box", "size": [0.145, 0.34, 0.165] }, "position": [0, -0.62, 0.015], "material": "wrap" },
    { "id": "ShinMarkR", "parent": "Leg_R", "shape": { "type": "box", "size": [0.08, 0.19, 0.02] }, "position": [0, -0.62, 0.105], "material": "accent" },
    { "id": "BootR", "parent": "Leg_R", "shape": { "type": "box", "size": [0.175, 0.14, 0.26] }, "position": [0, -0.735, 0.065], "material": "boot" },
    { "id": "SoleR", "parent": "Leg_R", "shape": { "type": "box", "size": [0.18, 0.045, 0.27] }, "position": [0, -0.804, 0.067], "material": "under" }
  ]
}
